{
  "id": "owl-parents-student-group",
  "name": "Owl Parents Student Group",
  "description": "Mission: Owl Parents Student Group aims to help past and present students and staff connect and share with other parents and caregivers to foster a supportive community at WGU.",
  "category": "Family & Life",
  "url": "https://cm.wgu.edu/t5/Owl-Parents-Student-Group/gh-p/owlparentsstudentclub",
  "type": "open",
  "access_requirements": "Open to all WGU students, staff, and alumni who are parents/caregivers",
  "target_audience": "WGU community members who are parents or caregivers",
  "member_count": 1115
}