{
  "id": "pride-owls-student-group",
  "name": "PRIDE Owls Student Group",
  "description": "Student group providing community and support for LGBTQ+ students and allies at WGU.",
  "category": "Diversity & Inclusion",
  "url": "https://cm.wgu.edu/t5/PRIDE-Owls-Student-Group/gh-p/prideowlsstudentclub",
  "type": "open",
  "access_requirements": "Open to all WGU students",
  "target_audience": "LGBTQ+ students and allies at WGU",
  "member_count": 1161
}