{
  "id": "alumni-cybersecurity-club",
  "name": "Alumni Cyber Security Club",
  "description": "Community space for WGU graduates in the Alumni Cyber Security Club.",
  "category": "Technology",
  "url": "https://cm.wgu.edu/t5/Alumni-Cyber-Security-Club/cmp-p/grouphub:alumnicybersecurityclub",
  "type": "closed",
  "access_requirements": "WGU graduates only",
  "target_audience": "WGU cybersecurity alumni",
  "member_count": 3047
}