{
  "id": "ebony-owls-student-group",
  "name": "Ebony Owls Student Group",
  "description": "Student group fostering community and support among Black/African American students at WGU.",
  "category": "Diversity & Inclusion",
  "url": "https://cm.wgu.edu/t5/Ebony-Owls-Student-Group/gh-p/ebonyowlsstudentclub",
  "type": "open",
  "access_requirements": "Open to all WGU students",
  "target_audience": "WGU students interested in diversity, equity, and inclusion initiatives",
  "member_count": 1867
}