{
  "id": "english-learners-exchange",
  "name": "English Learners' Exchange",
  "description": "English Learners' Exchange: A multilingual student learning community. Please visit the Academic Coaching Center Website for additional resources and support.",
  "category": "Academic Support",
  "url": "https://cm.wgu.edu/t5/English-Learners-Exchange/gh-p/englishlearners",
  "type": "open",
  "access_requirements": "Open to all WGU students",
  "target_audience": "Multilingual students and English language learners at WGU",
  "member_count": 192
}