{
  "id": "cybersecurity-club",
  "name": "Cybersecurity Club",
  "description": "Community space for students in the WGU Cyber Security Club.",
  "category": "Technology",
  "url": "https://cm.wgu.edu/t5/Cyber-Security-Club/cmp-p/grouphub:cybersecurityclub",
  "type": "closed",
  "access_requirements": "Membership may be restricted or require approval",
  "target_audience": "WGU students and alumni interested in cybersecurity",
  "member_count": 16754
}
